2022,"1학기","비대면이라 아주 널널하게 들었다. 시험 두 번이 과제로 대체된 게 정말 컸다. 과제로 내주는 기출 문제들이 난이도가 제법 있는 편이라 대면으로 전환되면 학점 따기는 많이 힘들어질 듯하다. 대신 지금보다 훨씬 더 많은 걸 배울 수 있겠지. 솔직히 미시경제학에 대해서 크게 배운 느낌은 없다. 교수님은 가르쳐주셨지만 열심히 듣지는 않았기 때문에.. 학점만 잘 받고 공부는 더 하는 걸로.",80
2021,"2학기","에제는 진짜 쉽게 얻어가요 근데 뭔가 이제 제대로 배우고 싶은 분들은 다른걸 듣는걸 추천합니다",80
2021,"2학기","한글로 들었으면 참 좋았을 것 같은 수업. 외국인들 없으면 가끔 한국말로 QnA 세션하시는데 그때는 참 잘 가르치신다. 근데 온라인 강의는...",100
2021,"1학기","A+은 힘들지만 A는 쉽게 받을수 있는 수업? 이번학기는 시험이 없어서 더욱 쉬웠던것 같네요.",100
2020,"2학기","피피티 자료와 교과서의 갭이 매우 큼..매주 복습하면서 책을 반드시 읽어야 함. 이번 학기는 성적을 후하게 주셨지만 앞으로는 그러지 않을거라고 알려주심",80
2020,"2학기","이번 학기에 유독 학점을 후하게 주시긴 한 것 같아요! 그래도 기말 난이도는 꽤 있는 편이었고 extra credit을 위한 Self QnA 덕분에 많은 것을 배울 수 있었던 것 같아요. 미시학 전체를 후생이랑 둘로 나누어 진행하시다 보니 더 자세하게 개념을 다룰 수 있었던 것 같아요.",80
2020,"2학기","성적을 잘 주시긴 했는데... 강의력은.. 음음...",60
2024,"여름","갓원용 교수님🫶 원용 교수님 수업은 정말 최고입니다! 일단 교수님 인품이 정말 좋으시고!!!!!!!!! 수업도 너무 좋았습니다! 그렇지만 계절 특성상 진도가 매우 빠르기에 진도를 따라가는 데 있어 버겁기는 했습니다. (근데 사실 전적으로 제 탓입니다. 제가 교수님 미원 수업 수강 시에 열심히 공부하지 않았고, 계절을 풀학점으로 들었어요.) 그래도 매일 수업 이후에 교수님이 올려주신 녹화본으로 복습하고 참고자료를 꾸준히 풀었더니 A+ 나왔습니다. 모르는 문제 있으면 항상 수업 시작 전이나 후에 교수님께 질문하면 친절하게 답해주십니다!! 저는 멍청해서 울면서 공부했지만 다들 똑똑하니 조금만 열심히 하면 충분히 좋은 성적 얻을 수 있을 겁니다!! 참고로 교수님이 수업 시간에 “이거 꼭 혼자 해보셔야 합니다~” 혹은 “내가 짜고 치는 거 싫어하는데... 이건 낼 겁니다~” 하는 부분은 대부분 시험에 출제되니 잘 체크해두시고 꼭 혼자 풀어보세요. 잘 모르겠으면 꼭 교수님께 여쭤보세요! 그러면 친절하게 설명해주십니다 ㅎㅎ 그리고 다들 출튀 그만합시다……. 아무리 녹화본을 올려주셔도 ㅠㅠ 그러지 맙시다!!!",100
2024,"여름","빛 원 용 절대 그를 의심하지마... 점수 망해도 A0 입에 쑤셔넣어주니까 버티세요 다들 그는 신이야! 그는 신이야! 그는 신이야! 그리고 인간적으로 출튀 작작하세요 다들 티 엄청 나게 대놓고 출튀하던데 교수님 다 알면서도 안잡으시는거에요...",100
2024,"여름","교수님 자체가 너무 좋으신 분이시고 강의 자료의 퀄리티도, 따로 주시는 연습문제도 너무 좋았습니다. 특히 풀이가 있어서 수업 시간에 잘 따라가지 못해도 올려주신 동영상과 함께 다시 공부할 수 있었습니다. 학교에 매 수업시간 일찍 오시고 질문이 있는 학생들을 위해 남아서 질문 받아주시고... 저같이 모자란 학생에게 경제학도로서의 기반을 닦을 기회를 마련해주셔서 정말 감사합니다. 계절학기 짧은 기간 동안 최대한 많은 것을 알려주시고자 하신 것도, 시험이 끝났음에도 별도로 공부하고 싶은 학생들이 공부할 수 있도록 기말 외의 범위 영상도 올려주셔서 해당 범위도 공부할 수 있었습니다. 문제 풀이 뿐만이 아닌 경제학이 어떻게 사용되어야 하는지 깨달음도 마음에 새길 수 있었습니다. 열린다면 꼭 들으세요 학점도 진짜 천사처럼 주십니다. 물론 계절 초수강이었던 저는 교수님의 강의를 따라가기엔 머리가 부족하여 눈물 죽죽 흘리면서 공부했습니다. 하지만 에이쁠 잘 받아갑니다!!! 출튀 너무 많은 것 같으면 가끔 호명하시니 그냥 웬만하면 수업 때 앉아계시고... 교수님 이번에 상처받으신거 같았습니다",100
2023,"겨울","그는 신이다 감히 찬양하지 아니할 수 없고 받들지 아니할 수 없다 겨울계절 1,2,3교시 매일매일 나오면서 덜 뜬 붕어눈들 앞에 두고 위트와 유우머 섞어가며 분위기 다운 안 되게 하면서도 개념과 원리 설명은 칼같이 하는 그는 일타강사다 수업 끝나고 질문 받아주는 걸 넘어 아예 카카오톡 친구추가 해서 언제나 궁금한 게 있으면 톡 보내 물어보라고, 늦은 밤에 톡해서 못 봐도 다음날 수업 중간 쉬는시간에 기꺼이 설명해주는 그는 친절의 인간화다 두 번의 쉬는시간이라지만 만만찮은 오전 3시간 연강을 하느라 고개 꾸벅꾸벅하며 늘어져도 집에 가서 다시 보고 복습하고 시험공부할 수 있게 매 강의마다 태블릿으로 녹화해서 영상으로 올려주는 그는 멀티미디어맨이다 시험 난이도를 조절해 가급적 어려운 문제 없이 풀 수 있게 해주고, 그럼에도 어려워할 다수의 미천한 중생들을 위해 유형과 범위 그리고 시험시간까지 넉넉하게 배려해주는 그는 성인군자다 워낙 학점 잘 준다는 소문 탓에 직전 학기 강의에서 제대로 하지 않고 낮은 점수를 받고도 좋은 학점을 바라는 일부 수강생 덕에 마음이 불편했음에도 이번 계절에 다같이 열심히 하자고 으쌰으쌰 해주고, 노력했음에도 점수가 생각보다 낮아 좌절과 불안에 떠는 중생들을 하해와 같이 푸근하고 너그러운 학점으로 품어주시는 그는 내 믿음이라 그는 구원자요 인도자이며 우리 경제중생의 어버이시니 그를 믿고 따라 최선을 다하되 감히 게을리해놓고 날로 먹으려 들지 말 것이며, 노력을 다했다면 믿어 의심치 말지어다 믿습니다! 믿습니다!!! 믿쑵니다!!!!!!!!!!! 용멘..",100
2023,"여름","여름계절) 시험 그렇게 어렵지 않고 중요한 개념들 쉽게 설명해주셔서 많이 배웠습니다!",100
2023,"1학기","감히 한원용을 의심하지마. 다른 말이 필요할까요? 미원 듣지도 않고 수강했지만 모든 수업 녹화로 올려주신 덕에 어렵지 않게 공부했습니다. 말이 안되는 후한 학점은 덤",100
2023,"여름","계절 재수강으로 들었습니다. 우선 학점부터 말씀드리자면 정말 후하게 주세요. 제 시험 점수 평균이 50점대인데 a0받았습니다. 출석 성실도가 얼마나 반영되는지는 모르겠지만 한번도 빠짐없이 9시맞춰서 3시간 모두 출석했어요. 교수님 설명 잘해주시고 시험문제도 합리적으로 내주셨다고 생각합니다(제가 6학점 듣느라 공부를 많이 못했어요ㅠㅠ) 덕분에 만족스러운 점수 받고 계절학기 잘 마무리합니다.",100
2023,"여름","경제학과 게시판에서 무조건 에제라는 말 안 믿었어요… 갓원용을 의심치 말지어다",100
2023,"1학기","대 원 용 중간 조지고 기말을 딱 중간정도 본것 같은데...ㅋㅋㅋ 앞으로 절대 의심하지 않겠습니다",100
2023,"1학기","절대 한원용을 의심하지마 다만 출튀하면 전부 세서 마지막 시간에 박제하여 런어스에 공유해주시므로, 교수님을 흑화케 하지 말 것.",100
2023,"1학기","수요일 금요일 1교시를 바칠만하다 학점 잘주는것도 잘주는건데 애초에 설명도 잘해주시도 강의안도 좋음",100
2023,"1학기","시험이 어렵더라도 점수가 망한 것 같더라도 현타가 와도 과목 자체가 어렵더라도 아침 일찍 일어나야해도 무조건 의.심.하.지.마",100
2022,"2학기","한원용은 신이야 모두 이 과목을 들어라... 눈 감고다녀도 a",100
2022,"2학기","같이 나태할 자신 있으면 최고의 강의. 강의력 좋아 과제 없어 성적 목구멍까지 먹여줘 강의 빠져... 하지만 성실함이 제 1 모토이신 분들은 피하시는 것도...",100
2022,"2학기","이 수업을 너무 늦게 들은 걸 후회함.. 내가 A0인 거면 수강생들 거의 전부 다 A0 이상이란 거임....",100
2022,"2학기","교양보다 더 좋다 이 교수는 학점으로 해줍니다. 수강 하기",100
2020,"2학기","쉽게 비쁠정도 받아가시고싶다 하시면 추천이지만 시험 방식이 에쁠받기에는 상당히 어려운것 같아요. 한문제에 10점씩이라,,,",100
2021,"1학기","그냥 개꿀 개망했는데 b주심 공무를 진짜 아예 안해도 잘 주심 그런데 조금 어려운 편인것 같음",80
2021,"1학기","학점이 제일 꿀이었지만 그래도 열심히는 해야했습니다",100
2021,"1학기","학점은 꿀 수업은 그럭저럭 시험은 객관식 타임어택이라 호불호 갈릴것 같습니다",60
2024,"1학기","이번 학기에는 범위를 많이 못 나가서 아쉬웠습니다. 저는 개인적으로 교수님께 질문을 많이 해서 작게는 내가 어디에서 오류를 범하고 있는지 크게는 경제학을 어떻게 공부하고 어떤 시각을 가져야 하는지 등 많이 배웠던 것 같습니다. 질문을 많이 하려면 연습 문제나 족보를 거의 바로 풀어봐야 해서 시험기간에 몰아서 공부하면 좀 힘들 수도 있을 것 같습니다.",100
2024,"1학기","연습문제만 몇번 반복해도 최소 에쁠 나옵니다.. 대신 부교재 문제 조금 서핑해두면 도움됩니다! 92.3/98.2로 달달하게 에이쁠 가져갑니다~",100
2024,"1학기","친절하게 개념 설명해주시고 학기초에 전년도 기출, 연습문제 올려주셔서 편하게 공부할 수 있었습니다.",100
2024,"1학기","수업 1도 안들어도 피피티 1회 정독 후 연습문제만 다 풀고 시험보면 충분히 A+ 받을 수 있는 꿀강 교수님이 족보도 직접 올려주시는데 시험이 족보와 연습문제의 유형을 벗어나지 않는다 대신 수업을 열심히 듣는 사람이라면 수업과 시험 사이의 괴리가 느껴질 수 있음 과거 명성에 비해 성적이 매우 너그럽거나 그런건 아니지만 적은 노력으로 (각 시험 이틀 정도 공부) 높은 점수를 받는 것이 충분히 가능한 수업.",100
2024,"1학기","교수님 너무 친절하시고 잘 가르쳐주십니다 아쉬운 점은 진도가 좀 느린 거..??? 시험은 2번 보는데, 올려주신 연습문제랑 기출문제 열심히 풀면 좋은 성적 받을 수 있어요.",100
2024,"1학기","교수님 인품이 훌륭하고 질문도 친절하게 받아주십니다. 그렇지만 매알 답장도 느리고 무엇보다 성적을 엄청 늦게 알려주세요 6/29에 성적공개인가 그랬는데 7/2까지 매일 포탈에 들어가게 만드셨습니다.. 솔직히 이것때문에 1점 뺀게 제일 커요 강의는 그냥 무난합니다. Ppt 깔끔하지만 깔끔하다 뿐이지 그것만으로 다 이해할 수 없어요. 수업은 개인적으로 조금 졸린데 수업을 듣든지 교재를 읽어야 ppt를 이해할 수 있습니다 시험은 기출을 푸는 게 제일 중요할 것 같아요 지난 후기들과 달리 더 이상 성적을 엄청 꿀로 주시진 않습니다.. 그렇다고 짠 건 또 아니고 그냥 FM인 거 같아요 개념 이해하고 연습문제랑 기출 다 풀어서 딱 A0 무난히 나왔습니다",80
2024,"1학기","수업내용과 강의안 대비 시험 난이도가 높다고 생각.",40
2024,"1학기","과제는 연습문제풀이 제출하는게 두번 있는데 답지도 주시기 때문에 사실상 교수님께서 공부좀하라고 내시는 과제라 부담없음. 초수강이라 살짝 걱정했는데 중간고사 89.6/100 기말고사 100/100 떠서 A+ 받아감. 중간고사때 90점 이상인 사람이 너무 많아서 망했다 싶었는데 기말로 충분히 만회 가능한 듯. 시험문제는 교수님께서 주시는 기출문제 유형이랑 거의 비슷하게 나오니까 기출문제 여러번 푸는게 제일도움됨. 아쉬웠던건 미시경제학 전체 진도를 다나가지 못했다는거.. 진도 안 나간 부분이 꽤 많아서 나중에 내가 따로 공부해야할듯ㅜ",100
2023,"2학기","A+ 받았지만 한학기 가장 스트레스 받은 수업. 다른 경제 수업과 비슷하게 강의는 피피티 설명이 끝이고 문제풀이는 본인이 알아서 책 찾아서 공부하면 됨. 기출은 주고 시험도 절반정도 비슷하게 나오는데 답지는 주지 않으니 알아서 풀어야함. 바쁘다면서 중간 성적 안알려주는건 강의평 보니 매번 그러시는 것 같은데 고치셨으면 좋겠음. 중간에 lnx 미분 쓰는 문제 나왔는데 수업시간에 안배워서 못 풀었다는 사람이 10명이 넘어서 처음에 교수님이 아예 채점 안한다고 해서 한참 시끄러웠는데, 경제학과시면 진심으로 반성해야 한다고 생각하고 타과생이시면 다른 과 전공 들을땐 전공기초 정도는 듣고 오세요. 연세대학교 경제학과 2학년 수업에서 lnx 미분하면 1/x 된다는걸 수업에서 다루지 않았으니 못 풀었다는 이의제기가 말이 된다고 생각하는지 진심으로 생각해 보시면 좋겠습니다.",60
2023,"2학기","나 왜 A+..? 진심..? 기출하고 연습문제 열심히 푸시고, (특히 기출) 추가적으로 응용될 수 있는 부분 서핑해서 공부해두시면 좋을 듯 합니다",100
2023,"2학기","학점 미화가 엄청나다. 그대의 상상 이상이다 결석 4번 이상 + 중간 망 = A+",100
2022,"2학기","진도가 조금 느리고 성적도 마지막에 알려주시는거 빼곤 교수님 강의력도 좋으시고 학점 미화돼서 걍 꿀",100
2022,"2학기","개인적으로 쉽게 가르치면서 성적도 무난하게 나온 갓 강의입니다",100
2023,"1학기","그저 빛.. 교수님 학생들 의견도 적극 반영하시고 착하시고.. 무엇보다 학점이 ㄹㅇ 천사이심",100
2023,"1학기","강의 자료가 매우 우수함.. 시험족보도 다 나누어 주셔서 솔강 가능 cpa 하다가 경제복전하는데 김판기다이어트좀 풀었으면 a+ 어렵지않음 처음듣는사람들도 연습문제 2번 정도면 시험 b+이상은나옴 매우매우매추 추천하는 수업 단점은 중간성적을 마지막에 알려주셨음...",100
2021,"1학기","미학은 미호경제학의 줄임말이다 강의 깔끔하시고 성적도 잘주심 ㅎ",100
2022,"2학기","우선 교수님께서 매우 친절하시고, 잘 구비된 강의자료도 공유해주셔서 좋았습니다. 수업은 미시경제학(이준구 저) 책 내용을 바탕으로 한 ppt로 수업이 진행됩니다. 내용은 필요한 부분만 보는 느낌입니다. 현시선호이론, 생산요소시장, 후생경제 부분은 생략하거나 얕게 다뤘습니다. 이 부분을 아쉬워 하는 분들도 있던 거 같습니다. 하지만 시험은 교수님께서 다룬 부분을 좀 깊게 이해해야 풀 수 있는 거 같습니다. 개인적으로는 교수님께서 올려주신 기출문제를 열심히 푸는 것이 중요한 거 같습니다. 마지막으로 과제가 있는데 교수님께서 올려주신 문제를 푸는 겁니다. 난이도도 쉽고 기간도 여유로우니 부담 가질 필요는 없는 거 같습니다.",100
2022,"2학기","교수님 매우 천사십니다. 공부 놔 버려서 기말 망쳤는데 저의 형편없는 답안지를 보시고도 멋쩍게 웃으시더니 비쁠을 주셨습니다… 강의력도 아주 좋으시고, 딕션도 좋고, 수업 자료도 교재 왜 샀지 싶을 만큼 퍼주십니다. 저는 그러고도 공부를 안 했네요. 교수님 죄송합니다… 여러분은 공부 열심히 하셔서 에이쁠 받아가세요ㅠㅠㅠ",100
2022,"2학기","강의 내용은 따라갈 만 한데, 시험 문제가 강의 내용과는 조금 다른 형식으로 출제되어 개인적으로 시험은 어렵게 느껴졌습니다. 교수님 정말 친절하십니다!",80
2021,"1학기","이런사람 또 없읍니다.. 학점 개잘줌 복학생의 빛",100
2023,"2학기","어렵다 근데 배워가는게 많다 경제에서 다루는 수학은 완전히 커버하는정도",100
2023,"2학기","내용 어렵고 시험도 빡빡하긴 한데, 서보윤 교수님만큼 강의력 좋고 학생 생각해주시는 교수님 많지 않다고 생각. 과제, 시험 어디서 깎였는지 다 올려주심.",100
2023,"2학기","I wish there could be english taught version of this class. This class covers very useful and important part of mathematics.",100
2023,"2학기","교수님보단 과목 자체의 문제가 있다고 생각함. 문과가는 이유로 얼버무리고 넘어가는 부분이 많은데 수학의 관점에서는 그 부분이 중요한 경우가 많음. 결국 남는 건, 결과를 이용한 계산 뿐이라 시험이 계산 숙련도를 요구하는 타임어택이 되어버릴 수밖에 없는 구조. 수학적으로 흥미로운 내용이냐 하면 아니다. 다만 앞으로 쓸모있는 내용이냐고 물으면 맞다.",80
2023,"2학기","사실 엄밀한 증명을 좋아하시고 어떤 지식을 곱씹는걸 좋아하신다면 아마 그렇게 좋아하실 과목은 아닐겁니다. 계산량도 많고 내용도 방대합니다. 타임어택도 심한편이구요. 하지만 강의 퀄리티와 교수자의 태도는 너무 좋다고 생각합니다. 최적화에 관심있으신분들이라면 꼭 들으시면 유익할 것 같습니다",100
2023,"2학기","강의력은 좋으시다.하지만 내용이 좀 어렵고 수학에 자신있으시는 분들이 듣는걸 추천한다.",80
2022,"2학기","내용이 많이 어려움. 수학 잘하는거 아니면 안듣는거 추천",80
2022,"2학기","강의내용은 심화적이고 어려우나 열심히듣고 따라가면 시험도 충분히 풀수있습니딘",100
2022,"2학기","저같은.. 무지한놈에게 비쁠을 하사하시다니.. ㅠㅠ 감사합니다 찬양합시다 서보윤 교수님",100
2021,"2학기","마지막에 강의 밀려서 기말 못보고 B+ㅠㅠ 그전까지 따라간건 다 잘본거 보면 강의 잘해주시고 그런거 맞음 다만 로드가 너무 많아서 겉핧기식이 될수있는게 좀 아쉬웠음 경제학 문제에 연관지어서 넣어주면 훨씬 좋아질거같음",100
2021,"2학기","두 시간은 영상 한 시간은 줌으로 수업하셨는데 출석체크는 줌 수업만 하십니다. 숙제도 없도 퀴즈 2번과 시험2번으로 평가하십니다. 양은 꽤 많고 시험문제도 좀 까다로운 편이지만 채점은 굉장히 후하게 해주싲니다.(계산 실수는 감점 안하시고 논리에 비약이 조금 있어도 감안해주시는 것 같습니다) 선배들한테 들었을 때도 그렇고 이번 학기에도 그랬는데 중간고사 끝나고 철회하는 인원이 많습니다. 그래서 좀 버티면 학생들 편의를 많이 봐주십니다(두번째 퀴즈와 기말은 범위를 누적하지 않았습니더)",100
2021,"2학기","처음 강의만 들으면 엄청 막막한데 연습문제 잘풀고 버리는 문제 없이 풀이가 좀 빈약하더라도 다 풀면 점수 어느 정도 나온다. 그걸 4번 반복하면 에이쁠 가능!",80
2021,"2학기","교수님이 질문에 대한 답변을 정말 빠르게 잘해주신다. 피드백이 빠른 부분이 좋았다. 기본적으로 수학을 잘하는 사람만 듣기를 추천한다. 증명+계산의 홍수를 통해 다른 과목과 병행하기에는 약간 벅찼다. 수학을 좋아했기에 버틸만 했다. 다만 아래 강의평대로 경제학에 응용하기 위한 수학을 배우러 왔다가, 단순히 라그랑지안, 미방, 정차방정식 등의 기계적 풀이만 익히고 간 것 같아 아쉽다. 경제학이랑 좀더 연결시켜 알려주시면 어땠을까 하는 생각이 든다. 예제와 연습문제 위주로 공부하는 것을 추천한다. 특히, 강의 때 알려주지 않고 연습문제에 담긴 유형이 퀴즈나 중간기말고사에 나오는 경우가 많으므로 연습문제 또한 많이 풀고 가는 것을 추천한다. 그래도 좋으신 교수님 덕분에 지루하지 않게 공부했던 것 같다. 수학 좋아하는 경제학도라면 추천한다!",80
2021,"2학기","학점 에쁠 근데 추천하지는 않음 수리적 엄밀함따위는 없는 계산 위주의 시험은 수학을 잘 하는 학생을 가리는 것인지 계산기를 가리려는 것인지 모르겠음 다루는 수학은 막 어렵지는 않으나 재미는 없었다",60
2021,"2학기","1. 개설 최적화와 미분방정식을 배운다. 이걸 듣고 무지성으로 쓰던 라그랑지안에 대한 체계적인 이해가 생겨 큰 도움이 됐다. 미분방정식 파트도 상당히 흥미로웠다. 시험은 쉽지는 않은데 대비할 수 있다. 본인은 에이쁠을 받았다. 2. 수업 동영상+실시간으로 한다. 동영상 수강은 꼭 하도록 하자. 강의안만 봐서는 이해하기 어렵다. 교수님이 친절하게 떠먹여주시니 열심히 동영상을 보자. 실시간은 큰 도움이 되는지는 모르겠다. 해당 주차의 내용을 거시적으로 통합해주시고, 동영상에서와 다른 접근으로 설명을 해주시긴 한다. 3. 시험 시험은 퀴즈 2번, 중간, 기말로 총 4번의 시험을 본다. 퀴즈와 중간/기말의 비중이 다르긴 하나 다 괜찮게 봐야 에이쁠이 나온다. 약간 타임어택의 느낌이 있으므로 연습문제 풀이를 반복해 숙달해놓는 것이 필요한 것 같다. 필자는 첫 퀴즈와 중간때 연습이 부족해 시간부족으로 몇 문제를 아예 손도 못댔다. 반성하고 열공한 두번째 퀴즈와 기말을 잘 봐서 만회한 것 같다. 5. 시험대비 조언 1) 강의 들으며 강의안 정독 및 예제풀이 2) 강의안 정리 3) 연습문제 풀이 4) 연습문제 정리 순서로 공부하는 게 좋은 것 같다. '풀이'와 '정리'를 구별해 놓은 것은, 이 과목은 '풀이'를 통한 문제해결 기술의 숙달과 '정리'를 통한 개념에 대한 유기적 이해를 요구하기 때문이다. 구체적으로 살피면 다음과 같다. 우선 강의를 들으며 강의안을 정독하고 강의안에 있는 예제를 풀이를 보면서 자신의 말(수학이니까 '식'이 될 것이다.)로 옮겨보도록 하자. 이 과정을 거쳐야 강의안의 내용을 문제를 풀 수 있는 수준으로 이해하게 된다고 생각한다. 이후에는 '정리'를 해야한다. 시험문제에 빠르게 접근하기 위해서는 그 문제에서 어떤 개념을 꺼내써야 하는지 정리가 되어 있을 필요가 있다. 그렇기에 개념과 개념 간 공통점과 차이점, 사고의 흐름을 별도의 용지에 정리해보는 것을 추천한다. 이게 정리된 상태에서는 연습문제 공부시간도 단축될 것이다. 서보윤 교수님 경수(2) 수업에서 '진짜'는 연습문제라고 생각한다. 강의안에 다 담지 못한 세세한 개념의 응용을 문제를 통해 보여주신다. 해설을 올려주시니, 최대한 혼자의 힘으로 풀어보되, 영 모르겠으면 해설을 봐도 큰 문제는 없다. 어차피 혼자 풀어낸 문제도 검토를 위해 해설을 보아야 하니 ㅇㅇ 이 또한 예제와 같이 자신의 말로 옮겨서 정제된 답안의 형태로 적어보는 것을 추천한다. 연습문제를 풀다보면 강의안에는 없는 개념의 응용이나, 문제풀이에서 실수하기 딱 좋은 것들이 파악될 것이다. 이것들을 정리해서 시험 직전에 한 번 볼 수 있도록 하자. 6. 나가며 수업 내용 자체가 빡세며, 경수(1) 정도의 수학적 베이스를 요구한다. 첫수업때 경수(1) 복습 같은 걸 해주시긴 하는데 개인적으로는 노베이스에게는 충분하지 않다고 생각한다. 그러니 이걸 들을 계획이라면 방학동안 경수(1)에 준하는 내용들을 복습하고, 미시경제학에서 무지성 라그랑지안으로 문제푸는 걸 좀 해보는 것을 추천한다. 모쪼록 이 글이 경수(2)를 듣는 이들에게 도움이 되길 바란다.",100
2021,"2학기","60명으로 시작한 강의가 1차퀴즈 끝나고 30명이 되었다. 수업은 너무 좋은데 제가 멍청이여서 도망치겠습니다… 죄송합니다 서보윤 교수님",100
2020,"2학기","정말 서보윤 교수님 갓보윤이십니다... 라그랑지안 KKT 미분방정식 배웁니다. 설명 엄청 자세히 잘해주시고 내용도 엄청 유익했어요",100
2020,"2학기","할 건 많지만, 개인적으로 수학 좋아해서 괜찮았음. 학점도 잘 주심. 굿.",100
