2017,"1학기","교수님 성격이 좋으시다. 학생들과 소통하신다. 하지만 수업 내용은 예습하지 않으면 수업때 바로바로 따라가기 어렵다.. 그래도 책이 있으니 후에 따라갈 수는 있다. 한 학기 내내 조모임으로 프로그래밍 큰거 하나 하는데 이게 시간을 많이... 많이 잡아먹는다. 할 일이 많으니 조원을 잘 만나는게 중요함. 한명이라도 안하면 나머지 사람들이 버겁다. 시험은 필기 1시간, 컴으로 실기 1시간 보는데, 그럭저럭 수업 난이도와 비슷하다...ㅎㅎ! 이번에 사람이 20명이 안돼서 절평 해주셨다. 감사합니다",80
2016,"2학기","1. +로 몰아주시지 않는다 2. 조원중에 프로그래밍 개념이 있는 사람이 없으면 매우 어렵다. 기말 프로젝트 끌고나가기가 어렵기 때문 근데 이번학기 보면 교수님이 계속 문제 해석을 쉬운쪽으로 해주셔서 꼭 필요한가 싶기도 함 3. 시험은 1시간 이론+1시간 모델링 4. 조교님ㅠㅠ 제발 과제 채점 교과서 신판 기준으로 해주시고 과제 답도 신판 기준으로 좀 올려주세요ㅠㅠ 아마 과제점수도 구판 기준으로 채점해서 잘못 나온거 같긴 한데 학점이 생각한 것보다 잘나와서 일단 교수님한테 메일은 안보냄 근데 꼭 개선은 필요함",60
2016,"2학기","궁금해서 들었다가 컴퓨터 관련 적성이 없어서 한 학기 내내 고생했습니다. 다른 조원을 보니 씨언어 등 전문적인 지식이 있어도 그렇게 도움이 크게 되지는 않는 것 같습니다. 프로젝트는 한 학기 내내 하는데 모여도 딱히 답이 안나와서(...) 프로젝트 보다는 시험이 많이 가르는 듯 합니다. 시험은 다양한 스타일로 내십니다. 이런 프로그램 다루는 것 좋아하시는 분이라면 괜찮을 지도 모르겠습니다.",60
2023,"2학기","김유성? no 대 유 성 대 유 성 회사법? good god goat",100
2023,"2학기","음.. 그정돈 아님 b권 나올 수도 있음. 중간 기말 타임어택이 은근 있기 때문에 조금 만만하게 봤다가 에마받음. 로스쿨 준비하시는 분들 많으신 거 같은데 법 용어 하나도 모르면 띠용스러운이 많았음,,",60
2023,"2학기","교수님 인성이 Goat임. 진짜 인성 좋으셔서 감동함.......",100
2023,"2학기","그냥 최고 에이쁠 누워서 떡먹기 수업 안듣고 시험 전날에만 들어도 되는데 내용이 알차니 그래도 잘 들으면 좋음",100
2023,"2학기","중간, 기말 전주는 시험에 나올 부분만 찝어주시는 리뷰시간이 있기에 A+받기위한 로드는 거의 없다고 봐도 무방합니다. 다만, 개념 및 판례를 모두 암기하려고 한다면 당연히 로드가 깁니다 교수님이 학생들의 피드백을 최대한 수용하려고 하시는데, 부디 선을 넘는 요청은 없길 바랍니다",100
2023,"2학기","로드가 뭐가많음 교수님 시험 개쉽게내줘서 공부안해도 됨 근데 수업내용 나름 재밌고 강의력 괜찮으셔서 알참",100
2023,"2학기","2시간 공부하고 올만점입니다 교수님이 거의 1+1=? 은 수준으로 문제를 내십니다 수업시간에 깨있기만 했다면 a+은 받으실 수 있을 겁니다",100
2023,"2학기","개인적으로 얻은거 없는 수업 학점은 잘줘도 로드가 많음 체감상 6학점이었다",40
2023,"2학기","김유성을 법무부장관으로 디테일하고 열정넘치는 수업 친절하고 사려깊은 질의응답 오픈북 시험에다 마지막까지 학생들을 배려해주시는 GOAT 연세대학교 경영대학 최고의 강의",100
2023,"2학기","수강신청이 제일 어려운 과목. 비대면 시험 내기만 하면 A+ 주십니다.",100
2023,"2학기","에이쁠의 향연과 동시에 수업도 알참 들으면 얻어갈 수 있는 건 많고 중간기말 부담은 적음",100
2023,"2학기","중간은 일반 보고서 형태 기말은 irac 방식의 사례형 문제 1개를 과제 형식으로 제출 중간 과제 성적, 기말 시험 성적은 안 알려주셨으나 그냥 에쁠을 뿌리신다. 그렇다고 수업이 부실한가? 아니다 충분히 잘 설명해 주신다!",100
2023,"2학기","어.....수업만 듣고 중간보고서 4페이지랑 기말 사례분석 1페이지반 걍 썼더니 에쁠이 찍혀있네.....?",100
2023,"2학기","꿀을 원한다면 그냥 무조건 담으세요 🍯 🍯 🍯",100
2023,"2학기","의심을 버리고 수강신청을 하시면 에이쁠이 내려올 것입니다",100
2021,"2학기","갓상일 그 자체.. 시키는 대로 하면 에이쁠 내용도 유익했고 교수님 너무 좋으셨어요",100
2022,"2학기","갓상일 최고세요ㅠㅜㅜㅜ 이번 학기에 들은 수업 중 가장 로드 없고 부담 없었는데 성적은 A+ 뿌리십니다!!! 만약에 절평이면 무조건 문상일 교수님 수업 들으세요!!! (근데 상평이면 많이 힘들수도 있겠다는 생각은 들어요...!)",100
2022,"2학기","솔직히 개꿀강입니다. 앞으로는 상평으로 바꾼다고 하시긴 했는데, 그럼에도 학생들 배려 많이 해주시는 건 변치 않을 듯 하네요.",100
2022,"2학기","수업도 너무 재밌었고 유익했습니다. 교수님께서 항상 학생들 편의를 봐주셔서 너무 감사했고 성적 평가 역시 학생들한테 유리한 쪽으로 해주시는거 같아요.. 진자 문상일 교수님 너무 추천합니다ㅠ 저라면 상평 돼도 들을거 같아요 그만큼 너무 좋습니다!",100
2022,"2학기","빛..갓.. 교수님이 너무 좋으세요.. 근데 담학기부턴 상대평가하신다고 하네요",100
2021,"2학기","갓상일 인품 좋으시고 성적 뿌리심 비cpa생이 들어도 전~~~~~~~혀 부담없는 강의 어지간한 p/np 과목보다 꿀임",100
2021,"2학기","상법 및 회사법은 무조건 문상일 교수님 들으세요 밑에 수강신청 성공=에이쁠이라고 하시는데 이보다 더 잘 표현할 수 없네요 교수님도 좋으신 분입니다",100
2021,"2학기","수강신청성공=에이쁠인듯 마일리지 튕기고 수변선착순도 튕겨서 다른 교수님으로 옮길까 하다 그냥 기다렸는데 정원 최대로 열어주심... 감사합니다",100
2021,"2학기","갓상일…사랑합니다…에이쁠…🖤 꼭 수강신청 성공해서 들으세요…",100
2021,"2학기","수업내용도 설명도 흥미로워서 재밌게 듣고 에쁠까지 쏠랑 챙겨갑니다! 상법에서 뵈어요 교수님",100
2021,"2학기","더 할 말이 있을까요.. 교수님, 수업 모두 완벽합니다",100
2021,"2학기","그저 빛이라고 밖에는 할 말이 없습니다 포브스 선정 졸업 전 꼭 들어봐야 할 경영학과 전선 TOP 5임 설명도 잘하시고 이해도 잘 되고 중간 기말 대체 과제도 학생들 배려해서 어렵게 안 내시고 거기에 학점도 잘 주신다? 안 듣고 졸업하면 손해입니다 꼭 들으세요",100
2021,"2학기","문상일 교수님은 천사입니다. 회사법 개관과 함께 거저 받아가는 A+",100
2021,"2학기","꿀강 중에 꿀강 중에 꿀강 중에 꿀강. 한 학기 총 3시간 투자로 에이쁠을 받을 수 있음.",100
2023,"2학기","이제 족보 안 타요… 막학기 꿀빨려고 듣는 거라면 비추 들을 수 있다면 다른 교수님 분반 추천합니다 강평에는 좋은 글만 있어서 현실적인 수강평 적고 갑니다 경영학과 게시판에 한 번만 검색해 보시면 왜 그런지 알 수 있으실 거예요",60
2023,"2학기","교수님을 회사법으로 처음 뵈었는데 정말 좋으십니다. 학생들 배려도 많이 해주시고, 성적도 잘 주시는 것 같습니다. 다만, 기말고사가 전범위다 보니 양이 어마어마해서 미리 공부해두시는 걸 추천합니다. 시험이 어렵지는 않으나 그래도 공부를 어느정도해야 안 헷갈리고 문제 풀 수 있습니다. 공부할 시간 부족하시면 큰 개념 위주라도 꼭 여러 번 반복해서 공부하세요!!!",100
2023,"2학기","그냥 뭐 인품 좋으시고 학점 잘 주시는 교수님의 표본이 아닐까 싶은.. 과거 씨파생이어서 공부할건 거의 없었지만 회사법 처음 공부하는 사람 입장에서는 로드가 상당하다고 느낄 수 있겠다 싶었습니다. 매주 판례요약과제 제출하는게 귀찮은 느낌이 있는데 하다보면 적당히 요령생겨서 금방 하게됩니다. 이번학기는 중간고사 레포트 제출, 기말고사는 시험으로 진행했고 기말고사가 전범위라 힘들었다는 얘기가 있는것 같습니다. 그래도 느낌은 시험과 무관하게 학점은 잘 주시는듯하네요. 개인적으로는 교수님 목소리가 너무 나긋나긋해서 뒤에 앉으면 잘 안들려서 아쉬웠습니다. 말끝을 약간 흘리시는 경향도 있는것 같아서 더 그렇게 느낀 것 같기도하네요. 그래도 항상 성실하게 수업해주셔서 감사한 마음이 들었습니다. 회사법은 다른 교수님들도 학점 워낙 잘주셔서 그냥 아무거나 골라잡아도 크게 무리 없을 듯 하네요. 상법이든 회사법이든 경영대 법과목은 에이쁠 받고 시작하는 느낌이 확실히 있습니다.",100
2023,"2학기","공부할때는 힘들었지만 학점 보면 미화됩니다.. 전날 밤샘 벼락치기 하면 에이쁠입니다 상법-회사법 김유돈 교수님으로 들으세용 추천 !!",100
2023,"2학기","성적 잘 주심. 매주 내는 판례과제도 힘들지 않은 수준임. 간단함. 다만 기말 시험 한 번에 전범위(600페이지)를 봐야하기 때문에 벼락치기가 불가능은 아니지만 좀 힘들 수 있음..문제는 어렵지 않음.",100
2023,"2학기","절대적으로 꿀강이긴 한데 다른 회사법에 비해 상대적으로 박탈감..?이 들 수도 있음. 상일은 시험 안 보고 유성은 오픈북에 공부 안 해도 만점받을 수 있게 출제되지만 유돈은 ppt 600페이지 분량 공부하고 들어가야 함.. 평소에 잘 해두면 할만한 양인데 다른 과목 공부랑 병행하면서 이틀 안에 끝내려고 하다보니까 진심 살자 마려웠음. 매주 꼬박꼬박 챙겨들을 자신 없으면 상일 유성 ㄱㄱ",80
2023,"2학기","회사법 강의는 다 꿀강. 걍 매주 판례요약 과제만 해서 내면 됨. 시험도 기말 한번이고, ppt 눈에 바르고 들어가서 시험보면 됨. 이분 학점도 매우 잘주심. 로준생 필수강의.",100
2022,"2학기","로드가 너무 많음 씨파생 아니면 비추함 진짜 성적은 뭐 내가 생각한 것보다 한단계 위로 줘서 좋았긴 한데 이럴 바엔 그냥 다른 과목 6학점 듣는게 나음",40
2022,"2학기","교수님 정말 좋으신 분입니다. 학생들을 최대한 배려하고자 노력하시는 모습이 눈에 보입니다. 회사법 전반에 대해 알고 싶으신 분이 들으시면 좋을 것 같은 강의입니다. 기말은 오픈 북으로 봤는데, 오픈 북이어도 어느정도 공부를 하실 필요가 있습니다.",80
2022,"2학기","수업자체는 뭘배우는지 모르겠는데 이 과목 특성상 어쩔 수 없는듯. 교수님이 변호사 판사 검사를 다 해본적이 있으셔서 존경심 upup 학생들 배려 많이해주시는 인간적인 겨수님",80
2022,"2학기","학점을 잘 주셔서 평점이 높은건가..? 정말 강의안 읽어주시기만 하신다.. 개념설명 x 개념읽어주기 o 지엽적인 부분은 읽어보면 이해될거라고 하셔서 강의에서 얻는건 1도 없음 출결용이지만 매주 판례요약 과제도 있어서 이해 안되는데 꾸역꾸역 요약해야돼요 강의 듣다가 답답해서 남기고 갑니다…… 들으시려는 분들 stay..",40
2020,"2학기","딱딱한 법수업이라 내용 자체가 엄청 재밌다고 할수는 없지만, 교수님께서 나름 재밌게 잘 설명해주시는 편 같아요. 학생들 배려도 많이해주시고, 인간적으로도 좋은 분이셔서 즐겁게 들었습니다. 실무에 대한 이야기도 종종 해주셔서 흥미롭습니다!",100
2020,"2학기","강약조절 잘하시고 시험도 적당한 난이도에 학점도 좋게 주시려고 하십니다. 시험 전에 중요한 부분만 좀 더 신경써서 읽고 시험보면 좋아요!",100
2020,"2학기","회사도 법도 잘 몰랐는데 교수님 진짜 친절하게 설명해주십니다! 예를 들어 설명해주시고 실제 직무 관련해서 알려주셔서 좋았어용 열심히 들었는데 시험이 너무 쉽게 나와서 약간 허탈했지만... 그래도 비대면이니까 학점 잘 주시려고 하신거니ㅎ 다들 이 수업 꼭 들으세요~",100
2020,"2학기","책읽어 주시는 교수님 성격 좋으시지만 공부를 위해서는 다른 교수님 수업 듣는게 좋은거 같다",60
2020,"2학기","말이 필요 없음.. 학기 중 아무런 노력 없이도 에이쁠 가져갈 수 있는 수업임.",100
2020,"2학기","수업자료 내용이 좋아서 읽어주는 수준이시긴 하지만 이해도 잘 되고 나름 실생활과 결합하여서 잘 설명해주심. 시험과 학점은 그냥 입아픈 수준이고.. 출결과제도 저번학기에 비해 많이 줄어서 그냥 완벽 그자체",100
2020,"2학기","그냥 충성입니다 걱정이 무색할 정도의 수업과 결과",100
2020,"2학기","오픈북 시험. 부담 없는 로드. 따라오기만 해도 에이쁠을 주시는 관대함. 교수님 바짓가랑이를 잡아서라도 꼭 들으시길 바랍니다",100
2020,"2학기","밑에 책 읽어줬다는 평이 있던데, 상법 수업도 들어봤었지만 김혁붕 교수님 플로우로 진짜 이해 잘되게 설명해주심 상법 기초 있으면 수업도 진짜 절 가르치시고 시험도 쉽고 학점도 잘 줌 개꿀임 그낭",100
2023,"2학기","학점이 후하다고는 결코 할 수 없는 과목. 그렇지만 학점과 무관하게 별 다섯개 받아 마땅한 강의라고 생각합니다. 유탈 출신이고 세법 점수가 원래 제일 잘 나왔었는데 법인세법 시험은 많이 못봤던 것 같네요. 이번학기기준 중간보다 기말이 어려웠고 1차 수준보다는 어려웠습니다(특히 말문제..) 강사출신이시다보니 강의력 정말 훌륭하시고 수험에 도움이 되는쪽으로 수업이 진행돼서 늘어지는 느낌없이 컴팩트한 느낌이라 좋았습니다. 저는 회시 관뒀지만 재시생이나 유예생분들이 들으면 정리하는 느낌으로 도움이 되는 수업이라고 생각이 드네요. 처음 공부하시는 분들은 애초에 잘 수강 안하실것 같긴 합니다. cpa, cta 기출문제 풀어오는 과제 총 2번에 중간고사 기말고사 출석으로만 성적평가하는 깔끔한 수업입니다. 조모임이나 잡다한 과제없이 사람 피곤하게 안하는 수업을 찾는다면 법인세법 들으면 됩니다. 다만 수강생들이 대부분 수험생 혹은 수험생출신인만큼 좋은 학점받기가 쉽지는 않은듯합니다. 인생에 대한 얘기도 가끔씩 해주시고 좋은 말씀 많이 해주십니다. 학기말에는 교수님보다는 선배님이라는 생각이 더 들었네요. 오랜만에 경영대에서 듣는 즐겁고 유익한 강의 잘 들었습니다!",100
2023,"2학기","중간은 쉽고 기말은 어려워~~ 학점 후한지는 모르겠음",100
2023,"2학기","과제는 5주차쯤 1번, 12주차쯤 1번 해서 총 2번 있었음. 그 주에 배운 내용 해당되는 기출 문제 4문제 푸는 거였고 답도 인터넷에 있어서 직접 풀고 답 맞혀보고 내면 됐음. 답 맞아야 점수 다 받을 수 있는 것 같으니 풀고 나서 꼭 답 찾아서 맞는지 확인하고 제출하길 바람. 시험은 중간, 기말 보는데 1차보다 살짝 어렵다고 하지만 실제 시험장 갔을 때 긴장감까지 고려하면 딱 적당한 난이도로 나오는 것 같음.",100
2023,"2학기","학점 나오기 전이라 성적이 어떻게 될 지는 모르겠으나, 확실히 강의력이 좋으셔서 법인세법 관련 개념을 정립하는데 많은 도움이 되었음.",100
2022,"2학기","제 기준 1차보다 어려웠던 중간, 기말고사입니다. 다만 교수님께서 너무 좋으시고 이해가 안되어서 무작위로 외웠던 부분들을 이해시켜주셔서 너무 만족스러웠던 수업입니다. 1차 준비생이라면 학점을 잘 받기는 어려울 수는 있지만 전반적으로 수험생활에 도움이 되지 않을까 생각합니다 :)",100
2022,"2학기","1차생이나 세법유예생이 들으면 좋은 강의. 강의력도 좋으시고 과제는 회계사 세무사 기출 5문제 정도 푸는 형식으로 두번 내주십니다. 시험은 어렵지만 1차 공부하듯 공부하시면 충분히 고득점 가능하실것 같네요.",100
2020,"2학기","강의력은 말할 필요도 없고 이번 학기 들은 수업 중 가장 깔끔하고 만족스러운 수업이었다. 과제도 그렇게 어렵지 않았다. 시험은 어려웠다. 난 그냥 적당히 교재 예제 풀고 시험 준비하다 말아먹고 현타 왔는데 다행히 학점은 잘 주셨다.",100
2020,"2학기","중간고사 보고 cpa는 내 길이 아닌가 싶었지만, 배워간 것이 정말 많은 수업이였습니다. 학점은 정말 잘 주셨어요. Cpa 1차 준비생들에게 진심으로 추천합니다!",100
2020,"2학기","1차 준비생의 상황에서 이번 수업을 들었습니다. 강의력 정말 좋으셨습니다. 나중에 2차강의를 듣게되면 이승원교수님 수업을 들어보고 싶을정도로 강의는 좋았습니다 다만 시험문제 정말 어려워요. 1차 준비생의 입장에서 문제보고 ""아 cpa는 내 길이 아니구나 ..접어야하나""라는 생각이 들 정도였습니다. 같이 들었던 합격생. 유예생 친구들 말로도 1차 이상의 난이도였음은 확실하다고 하더군요. 다만 난이도가 어려웠던만큼 점수도 후하게 주신것 같습니다 .",80
2020,"2학기","연대에서 절대 볼 수 없는, 아 이게 강의력 하나로 업계 제일의 학원 투탑자리까지 올라간 강사의 짬바구나 싶은 강의력... 이었지만 시험을 부분점수 없는 주관식으로 개어렵게 내셔서 트라우마 올 뻔 했습니다 하지만 학점기준은 매우 자비로우십니다 이게 앞으로도 계속 이럴지는 모르겠음. 대면강의 매우 하고싶으셨던 것 같은데 못 뵈어서 아쉬워요 + 교재 구성이 매우 깔끔하고 판서로 진행하셔서 더욱 좋았음",100
2020,"2학기","과제는 단순한 거 두번 잇었습니다. 유명 강사이신만큼 강의력은 보장됩니다. 솔직히 중간이 너무 어려웠고 기말도 쉬운편은 아니었어서 4점 드리려 했으나 학점을 받아보고 5점을 드립니다.",100
2020,"2학기","현직 강사분이시기에 강의력은 좋으시나 다만 세법을 처음 공부하는 사람들은 절대 듣지 말아야함 본인도 오티때 애초에 그렇게 말씀하셨고 강의도 세법을 1회독 이상 한 사람들이 듣기에 좋지 초심자가 듣기에 편한건 아닌듯 중간고사는 대환난 2차보다도 어려운 시험이었고 기말고사는 그거보다는 나았지만 문제난이도는 쉬운편은 아니었음 함정도 낚시도 많음 유예가 제일 듣기 편할거같고 1차생은 시험이 좀 힘들거같고 세법을 처음보는 사람들은 시험을잘보기 매우 어렵당",80
2020,"2학기","승철띠에 밀려 나무2인자에 항상 머물러있는 분이라고만 생각햇는데 중간고사를 치고 팬이되엇다 !! '-' 정말 문제를 fanxy하게 잘내신다 """" 올해 세법50후반으로 탈하고 슬퍼잇엇는데 왜 내가 세법유예가 되엇는지 뼈저리게 느끼게 해주었고 세법을 공부할때 어떤 마음가짐으로 다가가야하는지 내 대가리를 깨뜨려 깨우침을 선사해주었다 (특히 수입익不문제 2개는 CPA2012의 그것을 보는 듯 햇다 ! ) 내년에 세법을 넘기구 교수님께 감사 메일을 드리고 싶당 아 물론 이번학기 YSCEC강의는 들은적없다 모든 씨파생들 화이팅!!",100
2020,"2학기","일단 강의력이야 최고이셨고 1차준비생 2차생 기합모두에게 도움이되는 강의를 만드시겠다구 말씀하셨엇는데 기합인 입장으로도 배웟던것들을 재정리 하는 느낌이라 도움이 많이되었습니다 중간 기말고사도 cpa 스럽고 깔끔하게 출제해주셨구!! 다만 1차준비생들은 과목 특성상 유예생 기합이 많아서 상대적으로는 좋은점수 받기 어려울것 같아요!! 그래도 다른 강의들괴 비교했을때 가장 cpa에도움이 되는 수업!!",100
2020,"2학기","강사 시장에서 1타는 아닌데 어쨋든 강사니까 일반적인 교수님들보다 강의 실력은 월등함 대면수업 하면서 썰 풀어주시는거 듣고 싶었는게 그게 넘 아쉽다 ㅜㅜ",80
2020,"2학기","학원에서 강의하시던 분이라 강의력은 굉장히 좋은듯 중간고사는 유예생이나 합격생도 어려워할정도로 1차 수준을 한참 넘었고 기말고사는 1차 수준으로 보임 학점은 잘 못 받을것 같지만 얻어간것은 많았던 강의",80
2020,"2학기","학교와서 강의하고 싶다고 하셨지만.. 코로나로 인해 맞이한 비운의 온라인 강의 ver2.",100
2023,"2학기","중간 80, 기말 85 에제 받았습니다 저는 발음은 딱히 상관없었는데 시력이 좀 안 좋아서 그런지는 몰라도 필기를 알아보는 게 너무 힘들어서 계속 옆의 친구에게 도움을 받았습니다. 사실 cpa 기합이라 딱히 집중을 하지는 않았는데 옆에 친구가 거의 노베로 열심히 해서 성적 잘 받는 것 보고 열심히 하면 잘 나올 수 있겠구나~ 생각이 들었습니다. 교수님이 화가 좀 많으십니다. 영어 쓰실 때는 좀 분노조절이 되는 느낌인데 출석 부르실 때 한 명 한 명을 마치 화가 나신 것처럼 호명하십니다 흠…",60
2023,"2학기","중간 20점대 기말 40점대 맞은 바보한테 C0를 주셔서 졸업시켜주신 데에 감사드립니다. 수업은 못 알아들어도 과제로 나온 문제들만 벅벅 풀면 반반타작 정도는 가능한것같습니다.",100
2023,"2학기","네이티브 입장에선 어쩔지 모르겠는데 토종 한국인 입장에서 발음이 매우 친숙함. 알아듣기 힘들단 말 많아서 걱정했는데 전혀 문제 없었음. 진도도 많이 나가지 않고 매 챕터마다 예제 풀이 다 해주셔서 수업시간에 집중만 잘 한다면 추가로 공부할게 별로 없음. 과제없고 중간기말 50%씩. 시험도 그냥 수업때 배운거 그대로 나오는 수준. 회원1 큰 무리없이 들었으면 A+ 충분히 가능한 수업",100
2020,"2학기","교수님을 떠나서 강의가... 음 발음 알아듣기가 매우 힘듦 적응한다면 적응하겠지만... 판서도 처참하기에 초반부엔 발음과 판서를 견딜 각오를 하시길",40
2020,"2학기","길지 않은 강의 시간 안에 핵심을 잘 짚어주시고, 연습문제까지 많이 풀어주셔서 흥미롭게 들었습니다. 비록 녹강이었지먼 교수님께서도 강의하시면서 학생들을 많이 배려주해셨다고 느낄 수 있었던 것 같습니다. 다만 개인적으로 중간, 기말고사 합쳐서 성적이 나쁘지 않은 편이었는데도 불구하고 B0이 떠서 조금 아쉽네요. 이 부분에 있어 (교수님의 의사결정이 틀렸다기 보다는) 학점을 주시는데 너그러운 편은 아니실 수 있겠다는 생각이 들었습니다. 이 점 유의하시길 바랍니다.",60
2020,"2학기","교수님은 좋으시나 좋은 점수를 받음에도 불구하고 B+을 받아서 매우매우 기분이 안좋아요",60
2020,"2학기","수업이 매우 좋습니다 20~30분짜리 강의로 동영상 올려주시고 영어 강의지만 교수님이 영어가 아주 유창(?)하지는 않아서 처음엔 알아듣기 어렵지만 듣다보면 적응됩니다. 교재를 사용하긴 하지만 수업에서 쓰지는 않고 문제만 가져다 씁니다. 모든 수업은 판서로 이루어지는데 계산도 잘 틀리시고 글씨도 잘 못쓰시니까 감안해서 들으셔야해요. 과제는 교수님이 지정해주시는 문제 풀어서 내는 거고 2~3주에 한 번씩 냈습니다. 시험은 아주 어렵지는 않지만 서술형이라 부담이 좀 있어요. (중간고사에서는 수업에서는 메인으로 다루지 않은 분개+t계정 그리기 문제가 나와서 시간 많이 잡아먹어서 당황,,,,) 중간 기말 둘 다 꽤 잘봤지만 A0받았고 교수님께 커트라인 알려달라고 메일보냈지만 그냥 A+ 받기에는 점수가 부족하다는 답변만 해주고 커트라인은 안 알려주심. 학점을 후하게 주시는 편은 아님. 비율 맞춰 깐깐하게 주시는 듯.",80
2020,"2학기","영어 발음이 알아듣기 조금 힘들 수 있으나 그 외에는 수업 내용이 어려운 건 아니고 충분히 따라갈 수 있는 수준입니다! 시험도 어렵지 않게 나오고요. 다만 강의안이나 피피티라도 주시고 수업을 진행하셨으면 조금 더 배우는 입장에서 수월하지 않았을까 아쉬움이 있기는 합니다.",100
2020,"2학기","수업내용은 좋은데 체계가 좀 잡혀았었으면 좋겠다. 책으로 학습하는게 훨씬 이해 잘됨. 나머지는 무난함",60
