2022,"1학기","진짜 교수 같은 교수님… 아는 게 참 많으시고 수업을 집중해서 듣는다면 얻어가는 게 굉장히 많다. 말빨이 재밌으시다. 집값 떨어졌던 얘기 같은 걸로 자폭도 하시고 아무리 학생들이 과제 지시사항 안들어처먹고 계속 다시 물어봐도 계속 답변해주시는 여유와 온화함을 지닌 교수님이시다… 근데 조직행동이라는 분야 자체가 회계재무 좋아하는 친구들보다 인문학 좋아하는 친구들이 더 잘 맞을 분야라서 취향을 타는 것 같긴 하다 안맞아서 재미없어하는 순간 수업 못따라가고 성적 폭망하기 쉬움… 솔직히 이번 학기에는 수업도 안듣고 과제 설명해주시는 것도 제대로 안 들어놓고 성적 못받았다고 실망하는 동기들을 좀 봤다.. 열심히 한 친구들은 자기 실력치고는 잘 받았다고 하던데 관점의 차이 같다. 다음 학기가 상평일지라도 본인만 열심히 하면 열심히 한 만큼 받을 수 있을 거라 생각함 !! 국강이지만 교재와 피피티라 영어인 만큼 영어에 자신 없으면 비추 그치만 영어교재의 장점: 구글에 웬만하면 다 pdf있음 돈쓰지마세요 글쓰기 과제는 정말 이 분야에 관심이 있으면 재밌게 열심히 할 수 있음 실제 컨설팅 분야로 나가고 싶다면 한 번쯤은 겪어야 할 것들이라서..? 교수님 말씀이 만연체로 흘러간다는 얘기가 많은데 집중해서 듣기만 하면 사실 뭔 소린지 알아먹을 수 있다. 교수님 말씀 들으면서 빠르게 교안에 관련된 키워드가 있는지 스캔해보길.. 주로 교안 속 키워드에 대한 예시부터 말씀하셔서 이야기가 중구난방이고 장황하다는 평이 있는 것 같은데 결국 예시(구체)-핵심(요약)-이론(추상) 이런식으로의 적용이 이뤄진다. 매니지먼트 분야에 관심있는 경영학과생이라면 +영화를 좋아한다면 꼭들으세여 강추강추",100
2022,"1학기","의식의 흐름대로 진행되는 수업이지만 그 흐름을 따라가면 나름 재밌는 수업임 기말 한 번 보고 레포트 2개 쓰는데 레포트 분량도 부담스럽지 않고 수업 내용 토대로 약간의 창의력 발휘해서 쓰면 되는거라 각각 하루 (7-8시간)정도 투자해서 점수 평균 이상으로 받음 기말은 개념 위주로 외우면 되는 객관식이라 전범위가 시험 범위인 게 힘들었지만 깔끔하고 할 만했음",80
2022,"1학기","수업이 그냥 PPT 대로 딱딱 흘러가기 보다는 의식의 흐름처럼…물 흐르듯 흘러가니까 수업시간에 집중 안하면 지금 뭘 배우고 있는지 가닥 잡기가 어려웠습니다. PPT에는 핵심 개념 정도만 나와있으니 정신줄 꽉 잡고 교수님께서 덧붙여 설명하시는 내용 잘 정리해두어야 기말 공부할 때 이게 무슨 내용이었는지 기억할 수 있어요. 기말 한번이라 범위가 꽤 되니까 많이 밀리기 전에 복습해두는 것도 좋습니다. 과제는 경영 경제 이슈에 관한 기사 선정해서 에세이 쓰는 거랑, 케이스 분석 과제 하나 있었습니다. 에세이는 수업시간에 교수님이 어떤 방향으로 쓰면 좋은지 힌트를 주시니까 잘 캐치해두었다가 참고해서 쓰면 좋습니다. 수업시간에 배운 이론을 기계적으로 적용하기 보다는 자신의 의견이나 인사이트를 풍부하게 적어야 한다고 강조하셨습니다. 케이스 분석도 마찬가지로 단순히 이론적인 솔루션을 제시하기 보다는 실현 가능성이 있는 자신만의 아이디어가 들어가야 한다고 하셨습니다. 교수님께서 추구하시는 방향을 잘 이해하고 기준에 맞게 쓰면 좋은 점수를 받을 수 있지 않았을까 싶습니다…. 두 과제 모두 기말고사가 끝난 후에 점수만 공지해주셔서 정확히 어떤 부분에서 감점이 되었는지는 모르겠습니다,, 기말고사는 객관식 35문제로 출제되었고, 개념을 정확히 이해하고 있는지 묻는 문제가 많았습니다. 앞서 언급했듯 미리 강의 내용을 잘 필기하고 정리해두는 것이 중요합니다. 정확한 학점컷은 공개하지 않으셨지만 아마 레포트+기말+참여도 점수 합산해서 구간대로 끊어서 주신 것 같습니다. 참여도 점수는 공개되지 않아서 모르겠지만 수업시간에 꾸준히 발표하거나 마지막에 내주신 참여도 과제 공들여서 쓰면 잘 나왔을 것 같아요.",80
2022,"1학기","과제 2번에 기말 객관식, 참여 점수로 학점 산출하십니다. 교수님이 이야기하듯이 설명하셔서 꼼꼼히 받아적고 필기해야 해요 공부 열심히 한 편인데도 기말 객관식 시험이 범위도 많고 문제가 어려워서 좀 힘들었어요…그래도 수업 자체는 괜찮았다고 생각합니다",80
2022,"2학기","올해부터 객관식으로 기말 시험 바꾸셨는데 솔직히 이 과목 특성상 서술형이 더 맞다고 생각함. 그리고 기말 범위가 전범위인 것이 힘들었음.",40
2022,"1학기","레포트 두개 평균보다 높고 시험은 평균 이하임 (객관식, 반평균 37/70, 표준편차13) 결국 B0받았네요 그래도 수업은 유익하고 재밌었어요..",60
2022,"1학기","중간 전에는 널널했는데 중간 끝나고 레포트 2개 + 기말 진짜 빡셈 특히 레포트가.. 뭘 요구하는 건지 좀 모호해서 애를 먹었네요 ㅠ 그리고 기말고사 공부 열심히 하세요. 강의안 다 보시고 수업 내용 꼼꼼히 들어야 하는듯. 3회독 정도 하고 기말 잘 봤는데 그 덕에 재수강으로 에제 받음 교수님은 아는거 많으시고 진짜 똑똑하시고 뭔가 경영대 “교수님” 너무 잘어울리심 근데 좀 깐깐하시고.. 과목 특성상 어쩔 수 없겠지만 뭔가 다 모호함 ㅠㅠ 수업 열심히 들으세요 무조건",80
2022,"1학기","기말시험 한번 보기전에 레포트 두개 씀 개망한줄 알고 놓아버림 근데 시험 공부 열심히 할걸 그랬음 레포트 점수 평타는 쳤었음 ㅠ 여러분은... 시험공부 잘 하세요.. 강의 밀리지 않게 듣고...",40
2022,"1학기","보고서 두 개 다 쓰고 기말 봤는데 기말을 시험 일주일 전에 갑자기 객관식으로 변경하심. 내용도 모호해서 학점 의문사당함. 비추.",40
2022,"1학기","비대면이라 팀플은없었음 점수 나오기전이지만 수업에 대해서만 쓰자면 엄청 애매함 ㅠㅠ 근데 이건 오홍석교수님 뿐 아니라 모든 조직행동론이 그런듯.. 피피티랑 수업내용 녹화해서 달달외우면 시험은 잘볼듯 함. 수업 난이도가 높은건 절대아님 교수님 성품 좋으시고 너그러우심",80
2021,"2학기","2번의 과제와 1번의 시험 그리고 참여점수/출석으로 성적이 나왔다 교수님께서 공지해주시는 채점기준 잘 기억하고 과제와 시험 준비하면 좋은 성적 받을 것 같다 교수님 인자하시고 수업도 조직행동론 전반을 배울 수 있어 추천하고 싶은 수업이다",100
2021,"2학기","정말 정말 평소에 필기잘해두세요,, 안좋은 강평듣고 매우 걱정하듯 듣고 에타 강평보신다는 소리듣고 솔직히 철회도 하려했으나 애초에 과목자체가 정말 재밌게 들은 과목이라서 끝까지 들었습니다,, 시험 볼때 한번에 공부하기는 너무 힘든 과목이니 부디 평소에 차근히 복습해두시는게 좋을듯 합니다 과제 난이도도 생각보다 쉽지는 않았으나, 교수님 말씀하신 거 최대한 반영해서 써보는 걸 추천드립니다 A+받고 성취감 느끼고 갑니다!",100
2021,"2학기","수업 : 교수님 매우 인자하시고 무언가 술술 이야기 보따리 푸시는 느낌으로 강의하심. 정신줄 놓고 이야기 듣게 되는데 그러다가 중요한 부분 놓치는 경우가 많아서 워드나 메모장 키고 하시는 모든 말씀 주제별로 받아적는 것이 좋습니다. 수업이 끝나고 질문을 받는 것이 아니라 다음 시간에 받겠다고 하시는 것이 조금 불만이었다. 수업 끝나면 칼같이 줌 회의실 터뜨리시고, 다음 시간 시작 전에 질문하라고 하시는데, 학생 입장에서 현실적으로 지금 당장의 질문할 내용을 정리해서 다음 시간에 질문하기 쉽지 않다. 이거 빼고는 좋은 수업입니다. 과제 : 케이스 분석 과제는 매우 쉬웠음. 무언가 정답을 찾으려고 하지 말고 내 생각을 논리적으로 풀어내는 것이 중요하다. Real World Application Essay는 주제를 하나 정해서 실제 사례는 어떠한지, 나의 생각은 어떠한지 근거(기사,논문)을 바탕으로 나의 생각을 논리적으로 전개하는 것을 중점으로 한다. 시간 엄청 오래 잡아먹는다. 에타 강의평을 확인하신다고 하셨으며, 저번 학기 과제에 기준에 대해 이야기가 많이 나오자 이번 학기에는 체계적인 기준을 말씀해주셨다. 교수님 보고 계신가요? 충성충성 시험 : 기말 1회 전범위. 오픈북 논술형 문제이다. 오픈북인데 PDF, 태블릿과 같은 전자기기는 사용 불가능하고 오직 출력물만 사용할 수 있다. 만약 필기를 잘 못했다면 교과서를 참고할 수 있다. 한글로 된 교과서를 구매하는 것을 추천한다. 서술형 5개 문제를 작성하게 되는데 줄 제한까지 있어서 머리속에서 오만가지 생각을 들게하는 시험이었다. 논리적이고 체계적으로 내가 이 주제에 대해 이해하고 있다는 것을 어필해야 하는 시험이다. PPT에 적힌 내용 그대로 쓰면 20% 점수를 주신다고 하셨었다. 수업시간 : 3학점 수업인데 4시간짜리 수업이라고 생각하면 편하다. 3시간 수업 꽉 채우고도 녹강으로 1시간짜리 올려주시는 경우가 많았다. 이게 좀 불만이었다. 이거 말고는 딱히 큰 문제 없었다. 한 학기 재미있는 수업이었다. 예시를 드시면서 설명해주시는 것이 이야기 보따리 풀어주시는 것 같아서 몰입해서 듣다가 필기 놓친 적이 많아서 필기가 듬성듬성 되어있어서 시험보기 힘들었다 ㅋㅋㅋ.. 저번학기에는 악명이 자자하셨었는데, 이번 학기에 수강자로서 다른 사람에게 추천하고 싶은 수업이다.",100
2021,"2학기","강의력 좋으시고, 학생들 질문도 잘 받아주십니다! 개인적으로 조모임 없어서 정말 좋았습니다",100
2024,"1학기","교수님은 문제를 보완하시기 위해 발전하시는 교수님이십니다. 이번 학기에는 중간 기말이 모두 객관식으로 출제되었으며 과제는 이전과 동일하게 개인 에세이 하나 작성과 Case Analysis 하나를 작성하는 것이었습니다. 팀플은 없으며, 지정좌석제를 시행하시고 체크하지 않으시는 것 같지만 발표 및 결석 모두 체크하시니까 수업에 잘 참여하시는게 좋습니다. 개인 에세이는 처음에는 막막해보이지만 교수님이 제시해주신 HBR이나 DBR 같은 좋은 사이트에서 양질의 기사들을 찾으실 수 있으므로 2주 전이나 일찍이 시작하시는 걸 추천합니다. Case Analysis의 경우 개인적으로 에세이보다 쓰기 쉬웠고 개별적 insight로 문제를 분석하면 됩니다. 시간을 보다 많이 들여서 문제 분석, 해결책, 대안 등 글의 구조에 신경써서 읽기 쉬운 글을 쓰도록 노력해야 하기에, 이것도 1~2주 정도 잡고 쓰시는 걸 추천합니다. 중간고사와 기말고사는 모두 객관식으로 출제되었고, PPT slide 외 교재에서 출제된 문제들의 오답률이 높았습니다 (교수님 피셜). 그러므로 원문이든 한글판이든 교재를 구입하시는 걸 추천합니다. 시험기간에 몰아서 교재 부분을 보는 것만으로도 충분히 커버가 되기 때문에 교재는 좋은 점수를 위해 필요합니다. 교수님이 수업에 열정과 애정을 갖고 임하시는 모습이 보입니다. 수업이 너무 딱딱하지도 않고, 학생들이 잘 참여할 수 있게끔 분위기를 만들어주셔서 좋았습니다. 교수님이 추천해주신 영화는 방학 중에 한번 보겠습니다 한 학기 동안 감사했습니다~~",100
2023,"1학기","상대평가의 단점에 대해 배우는 상대평가 수업. 학기 내내 이 아이러니가 머릿속을 떠나지를 않았네요. 다른 절평 조행론보다 상평 조행론인 이 수업의 수강평이 비교적 좋은 편이기에, 한참 고민하다가 이 수업을 들어와서 수업 듣는 내내 했던 고민이었어요. 5점의 사유와 3점의 사유가 명확하기 때문에 중간값인 4점을 매겼습니다. 5점인 이유는 교수님이 교수님으로서, 그리고 연경선배님으로서 너무 좋으시고, 실제로 한 학기 동안 가장 배운 내용이 많은 수업이었기 때문입니다. 교수님께서 학생들의 실력을 인정하시면서도, 또한 저희 수준을 정확히 알고 계시다는 느낌을 많이 받았습니다. 대선배로서 너희가 이 정도는 해야지 그래도, 정도의 느낌으로 자잘하게 나름의 기준치를 제시하십니다. 일례로 두 페이지 분량의 과제 공지를 하시면서 교수님께서 하신 가장 기억에 남는 말씀은 “여러분들처럼 똑똑한 사람들은 과제 두 페이지를 쓸 때 대충 써도 금방 80점 정도의 퀄리티는 낼 수 있다. 그러나 90점 이상을 받으려면 애를 써야 한다. 그러다 보면 두 페이지가 모자랄 거다. 애를 써봐라.”라는 거였습니다. 과제를 하면서 느낀 건 말씀 그대로였습니다. 그리고 교수님께서 학기 초에 다른 조행론과 다른 교수님 조행론의 특징으로 많은 내용을 다루는 점을 꼽으셨는데, 실제로 이 수업을 통해 매니지먼트란 무엇인지를 조망하는 데에 손색이 없었다고 생각합니다. 인트로 강의가 3월 전반에 걸쳐 이어지기에 그랬던 것도 같네요. 사회학, 심리학, 경제학 모든 학문이 조금씩 다 어우러져있는 게 조직 분야이기에 인트로가 길어질 수밖에 없었다고도 생각하고, 그랬기에 매니지먼트 전반 나아가 school of business 전반에 대한 개론으로서 정말 적절했다고 생각합니다. 그러나 3점을 매길 수도 있는 이유는 중간, 기말시험을 준비하기에는 너무나 힘든 유형의 수업이었기 때문입니다. 교수님께서는 논란의 여지를 없애시고자 철저히 수업에 다루신 내용을 위주로 객관식 + 주관식 시험을 출제하십니다. 실제로 객관식 문제 각각의 발제 중 ‘수업시간의 논의에 따르면 올바르지 않은 것은?’과 같은 멘트가 등장합니다. 막상 시험이 끝나면 논란의 여지가 없이 모두가 승복할 수 있다는 점에서는 좋지만, 교수님의 모든 말씀을 거의 토씨 하나 틀리지 않게 모두 필기해야한다는 점이 너무 힘들었습니다. 중간 때 흘리어 들었던 내용도 시험에 출제되어서 기말 때는 정말 이 수업을 씹어먹겠다는 마음으로 덤벼 교수님 모든 말씀을 필기하고 정리했던 것 같습니다. 그리고 이건 이전의 후기들을 읽으면서도 각오하고 들어간 점이긴 했지만, 아래 그 사과가 왜 다냐면요.. 이 후기 쓰신 분 말씀이 맞았습니다. 교수님께서 되게 논리적으로 말씀하시는 건 맞는데, 전달하고자 하는 바가 많으셔서 말씀이 이래저래 샐 때가 좀 있어요. 다 도움이 되는 이야기는 맞지만 필기를 고스란히 받아들여야하는 입장에서는 맥락을 파악하기 힘들 때가 좀 있었어요. 결국에는 수업외적인 이야기들까지도 모두 다 일단 필기하고 봤었던 기억이 있어요.시험대비에 있어서는 모든 말씀을 필기해야한다는 점이 너무 괴롭지만, 동시에 시험 범위가 명확해지기에 논란의 여지가 없다는 점에서 시험대비에 한정해서는 3점이라고 생각합니다. 한 학기 흐름은 중간, case analysis 과제, 개인 에세이 과제, 수업 참여의 일환인 반 페이지 에세이 과제, 기말로 이어집니다. 중간 기말이 각각 100점, 나머지가 100점 도합 300점 만점이고, 학점은 제로까지 칼같이 나누어 주시는 듯합니다. 저는 중간 때 필기는 충실히 했으나 암기를 좀 덜 하고 들어가서 비제로권 점수를 받았다가, 막막해도 뒤집어보자 해서 과제랑 기말에 5월을 갈아넣었어요. 결과적으로 과제는 모두 평균 수준 점수를 받아서 아쉬웠으나, 기말을 많이 잘 봐서 에이제로로 한 학기 마무리했어요. 제로를 받았음에도 제 입장에서는 대역전이었기에 섭섭하지는 않았네요. 34위전에서 동메달을 딴 듯한 기분이랄까. 제로를 주신다는 점에서 혹자에게는 가혹한 강의일 수도 있고, 위에서 말씀드린 시험 준비 상의 단점으로 인해 수강을 망설이실 수도 있겠지만, 저는 어느 절평 수업보다도 값진 상평 수업이라고 생각합니다. 실제로 막막한 심정으로 기말을 준비하며, 개인적으로는 잘해야 비쁠이 뜨더라도, 혹여 그로 인해 내 학점평균이 낮아지더라도 이 수업 들은 건 후회하지 말자는 생각을 했었네요. 그래도 저는 교수님 전선 수업까지 들을지는 고민을 좀 해봐야할 것 같습니다.. 아무튼 매니지먼트 입문으로서 연경 최고의 조행론 수업이라고 생각하는 데에는 변함이 없습니다. 후배님들에게 이 긴 후기가 조금이나마 수강신청의 길잡이가 됐으면 싶네요. 한 학기 동안 감사했습니다 교수님.",80
2022,"2학기","이번학기 가장 걱정이 많았던 수업이었는데 결과적으론 가장 얻어가는게 많은 수업으로 남았네요. 중간 기말 둘 다 객관식+서술 시험 형식이고, 에세이 2번 있는데 시험은 열심히 준비하면 큰 문제 없이 풀 수 있는 난이도입니다. 저는 평소에 수업 열심히 듣고, 열심히 한 필기를 바탕으로 공부한 결과 중간, 기말 둘 다 상위권 성적을 받았고, 에세이도 좋은 성적 받아 최종 에이쁠 받았어요! 과거 강의평에 교수님 강의력에 대한 말이 많던데, 개인적으로는 굉장히 만족했습니다, 적절한 비유도 많이 쓰시고, 학생들이 이해하기 쉽게 잘 설명해주셨어요. 에세이 2개가 조금 힘든데, 글을 논리적으로 잘 쓸 자신 있으시면 추천 드립니다. 사실 모든 수업이 그렇듯 노력하면 좋은 성적을 거둘 수 있는 것 같아요. 평이 좋은 수업이라고 모두가 에이권을 받을 수 있는 것은 아니잖아요? 열심히 하시면 좋은 결과가 있을 것입니다.",100
2022,"2학기","로드 꽤 많다. 교수님은 열정적으로 수업하시고 수업의 질도 괜찮다. 개인적으로 이번 학기에 가장 배운 것 많은 강의인 듯하나 학점이 너그러운 편은 아니다. 중간 기만 다 상위 30% 내외에 과제 하나는 평균이상, 하나는 평균이하였고.. 에마는 나올 줄 알았지만 B0가 나왔다. 결론은 교수님도 훌륭하시고 좋은 강의이지만 공부한 것 대비 받아본 학점이 아쉽다.",60
2022,"1학기","기말 시험 방식이 서술형인 줄 알았는데 객관식이어서 오픈북이 아니게 되는 바람에 외우느라 힘들었습니다. 교수님 말씀 필기하는 것도... 조금 구조 잡기가 어려웠어요. 기말 시험은 한 번인데 전범위이고, 에세이로 중간고사가 대체되지만 에세이가 하나 더 있고, 수업 시간마다 토론에 참여해야 합니다. 참여 점수는 나중에 보충할 쪽글 과제를 주십니다. 중간 전까지는 진짜 좋았는데 그 이후에 에세이 두 개 내고 시험 준비하느라 너무 힘들었던... 그리고 에세이 점수도 제가 생전 처음 받아보는 점수라;;; 교수님이 생각하시는 잘 쓴 에세이 기준이 뭔지 모르겠어요... 글은 나름 잘 쓴다고 생각했는데ㅜㅜ 수업때 하도 열심히 참여해서 참여 점수 덕분에 A0 받긴 했지만 좀... 많이... 힘들었던 수업. 하지만 이건 제 나태함 탓도 클 것 같습니다... 미루지 말걸... 어쨌든 수업 자체는 재미있고 얻어가는 것도 좀 있는데 학점이 너무 짠 것 같습니다ㅜㅜㅜㅜ 상평 되면 어떨지는 모르겠네요.",60
2022,"2학기","교수님이....말을 너무 두서없게 하셔서 수업 듣는 내내 너무 짜증났음ㅠㅠㅠㅠㅠ 너무 생각의 흐름대로만 말씀하시고 정리가 안되어있어서 필기 내내 스트레스 교수님이 아시는게 많으신 건 알겠지만 그것때문에 자꾸 화두를 꺼내시면 배경까지 다 설명하시느라고 말이 옆으로 셈 예를들면 사과는 왜 다냐면요, 일단 사과는 과일의 종류인데, 아 과일에는 파인애플이라는 것도 있는데, 달다는 것은 결국 사과가 달다는 것은 물론 파인애플도 달 수 있고... <이런식으로 말씀하심 하... 결국 시간 들여서 꾸역꾸역 필기 전부 해가면서 외웠더니 시험은 잘봐서 A+ 받았지만 학점 미화되지 않았음 이 교수님께 두 번 듣고싶지 않다",60
2022,"1학기","진짜 교수 같은 교수님… 아는 게 참 많으시고 수업을 집중해서 듣는다면 얻어가는 게 굉장히 많다. 말빨이 재밌으시다. 집값 떨어졌던 얘기 같은 걸로 자폭도 하시고 아무리 학생들이 과제 지시사항 안들어처먹고 계속 다시 물어봐도 계속 답변해주시는 여유와 온화함을 지닌 교수님이시다… 근데 조직행동이라는 분야 자체가 회계재무 좋아하는 친구들보다 인문학 좋아하는 친구들이 더 잘 맞을 분야라서 취향을 타는 것 같긴 하다 안맞아서 재미없어하는 순간 수업 못따라가고 성적 폭망하기 쉬움… 솔직히 이번 학기에는 수업도 안듣고 과제 설명해주시는 것도 제대로 안 들어놓고 성적 못받았다고 실망하는 동기들을 좀 봤다.. 열심히 한 친구들은 자기 실력치고는 잘 받았다고 하던데 관점의 차이 같다. 다음 학기가 상평일지라도 본인만 열심히 하면 열심히 한 만큼 받을 수 있을 거라 생각함 !! 국강이지만 교재와 피피티라 영어인 만큼 영어에 자신 없으면 비추 그치만 영어교재의 장점: 구글에 웬만하면 다 pdf있음 돈쓰지마세요 글쓰기 과제는 정말 이 분야에 관심이 있으면 재밌게 열심히 할 수 있음 실제 컨설팅 분야로 나가고 싶다면 한 번쯤은 겪어야 할 것들이라서..? 교수님 말씀이 만연체로 흘러간다는 얘기가 많은데 집중해서 듣기만 하면 사실 뭔 소린지 알아먹을 수 있다. 교수님 말씀 들으면서 빠르게 교안에 관련된 키워드가 있는지 스캔해보길.. 주로 교안 속 키워드에 대한 예시부터 말씀하셔서 이야기가 중구난방이고 장황하다는 평이 있는 것 같은데 결국 예시(구체)-핵심(요약)-이론(추상) 이런식으로의 적용이 이뤄진다. 매니지먼트 분야에 관심있는 경영학과생이라면 +영화를 좋아한다면 꼭들으세여 강추강추",100
2022,"1학기","의식의 흐름대로 진행되는 수업이지만 그 흐름을 따라가면 나름 재밌는 수업임 기말 한 번 보고 레포트 2개 쓰는데 레포트 분량도 부담스럽지 않고 수업 내용 토대로 약간의 창의력 발휘해서 쓰면 되는거라 각각 하루 (7-8시간)정도 투자해서 점수 평균 이상으로 받음 기말은 개념 위주로 외우면 되는 객관식이라 전범위가 시험 범위인 게 힘들었지만 깔끔하고 할 만했음",80
